{
  "$schema": "https://json-schema.org/draft/2020-12/schema",
  "$id": "https://local.aspa.example/research/source-record.schema.json",
  "title": "Aspa canonical research source record schema 2.0",
  "type": "object",
  "additionalProperties": false,
  "required": [
    "id",
    "название",
    "авторы",
    "год",
    "издание",
    "модальность",
    "задача",
    "метод",
    "датасет",
    "производительность",
    "кросс_субъект",
    "релевантность",
    "ограничения",
    "тип_источника",
    "identifiers",
    "provenance",
    "evidence",
    "validation",
    "relations",
    "risk_flags",
    "field_resolution"
  ],
  "properties": {
    "id": {
      "type": "string",
      "pattern": "^S[0-9]{3,}$"
    },
    "название": {
      "type": "string",
      "minLength": 1
    },
    "авторы": {
      "type": [
        "string",
        "null"
      ]
    },
    "год": {
      "type": [
        "integer",
        "null"
      ],
      "minimum": 1900,
      "maximum": 2100
    },
    "издание": {
      "type": [
        "string",
        "null"
      ]
    },
    "модальность": {
      "type": [
        "string",
        "null"
      ]
    },
    "задача": {
      "type": [
        "string",
        "null"
      ]
    },
    "метод": {
      "type": [
        "string",
        "null"
      ]
    },
    "датасет": {
      "type": [
        "string",
        "null"
      ]
    },
    "производительность": {
      "type": [
        "string",
        "null"
      ]
    },
    "кросс_субъект": {
      "type": [
        "string",
        "null"
      ]
    },
    "релевантность": {
      "type": "integer",
      "minimum": 1,
      "maximum": 5
    },
    "ограничения": {
      "type": [
        "string",
        "null"
      ]
    },
    "тип_источника": {
      "type": "string",
      "minLength": 1
    },
    "identifiers": {
      "type": "object",
      "additionalProperties": false,
      "required": [
        "doi",
        "pmid",
        "arxiv_id",
        "patent_id",
        "dataset_id",
        "exact_url"
      ],
      "properties": {
        "doi": {
          "type": [
            "string",
            "null"
          ]
        },
        "pmid": {
          "type": [
            "string",
            "null"
          ]
        },
        "arxiv_id": {
          "type": [
            "string",
            "null"
          ]
        },
        "patent_id": {
          "type": [
            "string",
            "null"
          ]
        },
        "dataset_id": {
          "type": [
            "string",
            "null"
          ]
        },
        "exact_url": {
          "type": [
            "string",
            "null"
          ],
          "format": "uri"
        }
      }
    },
    "provenance": {
      "type": "object",
      "additionalProperties": false,
      "required": [
        "import_source",
        "retrieved_at",
        "search_stream",
        "query_or_seed",
        "iteration"
      ],
      "properties": {
        "import_source": {
          "type": "string",
          "minLength": 1
        },
        "retrieved_at": {
          "type": [
            "string",
            "null"
          ],
          "format": "date"
        },
        "search_stream": {
          "type": [
            "string",
            "null"
          ]
        },
        "query_or_seed": {
          "type": [
            "string",
            "null"
          ]
        },
        "iteration": {
          "type": [
            "string",
            "integer",
            "null"
          ]
        }
      }
    },
    "evidence": {
      "type": "object",
      "additionalProperties": false,
      "required": [
        "species",
        "population",
        "subject_domain",
        "modalities",
        "sample_size",
        "target_construct",
        "target_label",
        "access_status",
        "evidence_role"
      ],
      "properties": {
        "species": {
          "type": [
            "string",
            "null"
          ]
        },
        "population": {
          "type": [
            "string",
            "null"
          ]
        },
        "subject_domain": {
          "type": "string"
        },
        "modalities": {
          "type": "array",
          "items": {
            "type": "string"
          },
          "uniqueItems": true
        },
        "sample_size": {
          "type": [
            "string",
            "integer",
            "null"
          ]
        },
        "target_construct": {
          "type": "string"
        },
        "target_label": {
          "type": [
            "string",
            "null"
          ]
        },
        "access_status": {
          "type": "string"
        },
        "evidence_role": {
          "type": "string"
        }
      }
    },
    "validation": {
      "type": "object",
      "additionalProperties": false,
      "required": [
        "status",
        "screening_status",
        "full_text_status",
        "checked_at",
        "split_unit",
        "cross_subject",
        "external_validation",
        "calibration",
        "uncertainty",
        "exclusion_reason",
        "notes"
      ],
      "properties": {
        "status": {
          "type": "string"
        },
        "screening_status": {
          "type": "string"
        },
        "full_text_status": {
          "type": "string"
        },
        "checked_at": {
          "type": [
            "string",
            "null"
          ],
          "format": "date"
        },
        "split_unit": {
          "type": "string"
        },
        "cross_subject": {
          "type": "string"
        },
        "external_validation": {
          "type": "string"
        },
        "calibration": {
          "type": "string"
        },
        "uncertainty": {
          "type": "string"
        },
        "exclusion_reason": {
          "type": [
            "string",
            "null"
          ]
        },
        "notes": {
          "type": [
            "string",
            "null"
          ]
        }
      }
    },
    "relations": {
      "type": "array",
      "items": {
        "type": "object",
        "additionalProperties": false,
        "required": [
          "type",
          "target_id",
          "external_id",
          "note"
        ],
        "properties": {
          "type": {
            "type": "string"
          },
          "target_id": {
            "type": [
              "string",
              "null"
            ],
            "pattern": "^S[0-9]{3,}$"
          },
          "external_id": {
            "type": [
              "string",
              "null"
            ]
          },
          "note": {
            "type": [
              "string",
              "null"
            ]
          }
        }
      }
    },
    "risk_flags": {
      "type": "array",
      "items": {
        "type": "string"
      },
      "uniqueItems": true
    },
    "field_resolution": {
      "type": "object",
      "additionalProperties": {
        "$ref": "#/$defs/resolved"
      },
      "required": [
        "авторы",
        "год",
        "издание",
        "модальность",
        "задача",
        "метод",
        "датасет",
        "производительность",
        "кросс_субъект",
        "ограничения",
        "identifiers.doi",
        "identifiers.pmid",
        "identifiers.arxiv_id",
        "identifiers.patent_id",
        "identifiers.dataset_id",
        "identifiers.exact_url",
        "provenance.retrieved_at",
        "provenance.search_stream",
        "provenance.query_or_seed",
        "provenance.iteration",
        "evidence.species",
        "evidence.population",
        "evidence.subject_domain",
        "evidence.modalities",
        "evidence.sample_size",
        "evidence.target_construct",
        "evidence.target_label",
        "evidence.access_status",
        "validation.checked_at",
        "validation.split_unit",
        "validation.cross_subject",
        "validation.external_validation",
        "validation.calibration",
        "validation.uncertainty",
        "validation.exclusion_reason",
        "validation.notes"
      ]
    }
  },
  "$defs": {
    "locator": {
      "type": "object",
      "additionalProperties": false,
      "required": [
        "url",
        "locator"
      ],
      "properties": {
        "url": {
          "type": "string",
          "minLength": 1
        },
        "locator": {
          "type": "string",
          "minLength": 1
        }
      }
    },
    "resolved": {
      "type": "object",
      "additionalProperties": false,
      "required": [
        "state",
        "value",
        "reason",
        "checked_at",
        "locators"
      ],
      "properties": {
        "state": {
          "enum": [
            "reported",
            "not_reported",
            "not_applicable",
            "unavailable_after_search"
          ]
        },
        "value": {},
        "reason": {
          "type": "string",
          "minLength": 1
        },
        "checked_at": {
          "type": "string",
          "format": "date"
        },
        "locators": {
          "type": "array",
          "minItems": 1,
          "items": {
            "$ref": "#/$defs/locator"
          }
        }
      }
    }
  }
}
