{
  "id": "S999999",
  "название": "Replace with the exact source title",
  "авторы": null,
  "год": null,
  "издание": null,
  "модальность": null,
  "задача": null,
  "метод": null,
  "датасет": null,
  "производительность": null,
  "кросс_субъект": null,
  "релевантность": 3,
  "ограничения": null,
  "тип_источника": "метод",
  "identifiers": {
    "doi": null,
    "pmid": null,
    "arxiv_id": null,
    "patent_id": null,
    "dataset_id": null,
    "exact_url": null
  },
  "provenance": {
    "import_source": "data/staging/inbox/replace-me.json",
    "retrieved_at": null,
    "search_stream": null,
    "query_or_seed": null,
    "iteration": null
  },
  "evidence": {
    "species": null,
    "population": null,
    "subject_domain": "unavailable_after_search",
    "modalities": [],
    "sample_size": null,
    "target_construct": "unavailable_after_search",
    "target_label": null,
    "access_status": "unavailable_after_search",
    "evidence_role": "not_assigned"
  },
  "validation": {
    "status": "unverified",
    "screening_status": "pending",
    "full_text_status": "not_checked",
    "checked_at": null,
    "split_unit": "not_reported",
    "cross_subject": "not_reported",
    "external_validation": "not_reported",
    "calibration": "not_reported",
    "uncertainty": "not_reported",
    "exclusion_reason": null,
    "notes": "Candidate record; not yet accepted as evidence."
  },
  "relations": [],
  "risk_flags": [
    "missing_primary_identifier"
  ],
  "field_resolution": {
    "авторы": {
      "state": "unavailable_after_search",
      "value": null,
      "reason": "Значение не удалось установить по доступному первичному или библиографическому источнику; отсутствие зафиксировано без догадки.",
      "checked_at": "2026-09-23",
      "locators": [
        {
          "url": "local:validation-log",
          "locator": "canonical field авторы"
        }
      ]
    },
    "год": {
      "state": "unavailable_after_search",
      "value": null,
      "reason": "Значение не удалось установить по доступному первичному или библиографическому источнику; отсутствие зафиксировано без догадки.",
      "checked_at": "2026-09-23",
      "locators": [
        {
          "url": "local:validation-log",
          "locator": "canonical field год"
        }
      ]
    },
    "издание": {
      "state": "unavailable_after_search",
      "value": null,
      "reason": "Значение не удалось установить по доступному первичному или библиографическому источнику; отсутствие зафиксировано без догадки.",
      "checked_at": "2026-09-23",
      "locators": [
        {
          "url": "local:validation-log",
          "locator": "canonical field издание"
        }
      ]
    },
    "модальность": {
      "state": "unavailable_after_search",
      "value": null,
      "reason": "Значение не удалось установить по доступному первичному или библиографическому источнику; отсутствие зафиксировано без догадки.",
      "checked_at": "2026-09-23",
      "locators": [
        {
          "url": "local:validation-log",
          "locator": "canonical field модальность"
        }
      ]
    },
    "задача": {
      "state": "unavailable_after_search",
      "value": null,
      "reason": "Значение не удалось установить по доступному первичному или библиографическому источнику; отсутствие зафиксировано без догадки.",
      "checked_at": "2026-09-23",
      "locators": [
        {
          "url": "local:validation-log",
          "locator": "canonical field задача"
        }
      ]
    },
    "метод": {
      "state": "unavailable_after_search",
      "value": null,
      "reason": "Значение не удалось установить по доступному первичному или библиографическому источнику; отсутствие зафиксировано без догадки.",
      "checked_at": "2026-09-23",
      "locators": [
        {
          "url": "local:validation-log",
          "locator": "canonical field метод"
        }
      ]
    },
    "датасет": {
      "state": "unavailable_after_search",
      "value": null,
      "reason": "Значение не удалось установить по доступному первичному или библиографическому источнику; отсутствие зафиксировано без догадки.",
      "checked_at": "2026-09-23",
      "locators": [
        {
          "url": "local:validation-log",
          "locator": "canonical field датасет"
        }
      ]
    },
    "производительность": {
      "state": "unavailable_after_search",
      "value": null,
      "reason": "Значение не удалось установить по доступному первичному или библиографическому источнику; отсутствие зафиксировано без догадки.",
      "checked_at": "2026-09-23",
      "locators": [
        {
          "url": "local:validation-log",
          "locator": "canonical field производительность"
        }
      ]
    },
    "кросс_субъект": {
      "state": "unavailable_after_search",
      "value": null,
      "reason": "Значение не удалось установить по доступному первичному или библиографическому источнику; отсутствие зафиксировано без догадки.",
      "checked_at": "2026-09-23",
      "locators": [
        {
          "url": "local:validation-log",
          "locator": "canonical field кросс_субъект"
        }
      ]
    },
    "ограничения": {
      "state": "unavailable_after_search",
      "value": null,
      "reason": "Значение не удалось установить по доступному первичному или библиографическому источнику; отсутствие зафиксировано без догадки.",
      "checked_at": "2026-09-23",
      "locators": [
        {
          "url": "local:validation-log",
          "locator": "canonical field ограничения"
        }
      ]
    },
    "identifiers.doi": {
      "state": "not_applicable",
      "value": null,
      "reason": "Поле неприменимо к типу и роли данного источника.",
      "checked_at": "2026-09-23",
      "locators": [
        {
          "url": "local:validation-log",
          "locator": "canonical field identifiers.doi"
        }
      ]
    },
    "identifiers.pmid": {
      "state": "not_applicable",
      "value": null,
      "reason": "Поле неприменимо к типу и роли данного источника.",
      "checked_at": "2026-09-23",
      "locators": [
        {
          "url": "local:validation-log",
          "locator": "canonical field identifiers.pmid"
        }
      ]
    },
    "identifiers.arxiv_id": {
      "state": "not_applicable",
      "value": null,
      "reason": "Поле неприменимо к типу и роли данного источника.",
      "checked_at": "2026-09-23",
      "locators": [
        {
          "url": "local:validation-log",
          "locator": "canonical field identifiers.arxiv_id"
        }
      ]
    },
    "identifiers.patent_id": {
      "state": "not_applicable",
      "value": null,
      "reason": "Поле неприменимо к типу и роли данного источника.",
      "checked_at": "2026-09-23",
      "locators": [
        {
          "url": "local:validation-log",
          "locator": "canonical field identifiers.patent_id"
        }
      ]
    },
    "identifiers.dataset_id": {
      "state": "not_applicable",
      "value": null,
      "reason": "Поле неприменимо к типу и роли данного источника.",
      "checked_at": "2026-09-23",
      "locators": [
        {
          "url": "local:validation-log",
          "locator": "canonical field identifiers.dataset_id"
        }
      ]
    },
    "identifiers.exact_url": {
      "state": "unavailable_after_search",
      "value": null,
      "reason": "Значение не удалось установить по доступному первичному или библиографическому источнику; отсутствие зафиксировано без догадки.",
      "checked_at": "2026-09-23",
      "locators": [
        {
          "url": "local:validation-log",
          "locator": "canonical field identifiers.exact_url"
        }
      ]
    },
    "provenance.retrieved_at": {
      "state": "unavailable_after_search",
      "value": null,
      "reason": "Значение не удалось установить по доступному первичному или библиографическому источнику; отсутствие зафиксировано без догадки.",
      "checked_at": "2026-09-23",
      "locators": [
        {
          "url": "local:validation-log",
          "locator": "canonical field provenance.retrieved_at"
        }
      ]
    },
    "provenance.search_stream": {
      "state": "unavailable_after_search",
      "value": null,
      "reason": "Значение не удалось установить по доступному первичному или библиографическому источнику; отсутствие зафиксировано без догадки.",
      "checked_at": "2026-09-23",
      "locators": [
        {
          "url": "local:validation-log",
          "locator": "canonical field provenance.search_stream"
        }
      ]
    },
    "provenance.query_or_seed": {
      "state": "unavailable_after_search",
      "value": null,
      "reason": "Значение не удалось установить по доступному первичному или библиографическому источнику; отсутствие зафиксировано без догадки.",
      "checked_at": "2026-09-23",
      "locators": [
        {
          "url": "local:validation-log",
          "locator": "canonical field provenance.query_or_seed"
        }
      ]
    },
    "provenance.iteration": {
      "state": "unavailable_after_search",
      "value": null,
      "reason": "Значение не удалось установить по доступному первичному или библиографическому источнику; отсутствие зафиксировано без догадки.",
      "checked_at": "2026-09-23",
      "locators": [
        {
          "url": "local:validation-log",
          "locator": "canonical field provenance.iteration"
        }
      ]
    },
    "evidence.species": {
      "state": "unavailable_after_search",
      "value": null,
      "reason": "Значение не удалось установить по доступному первичному или библиографическому источнику; отсутствие зафиксировано без догадки.",
      "checked_at": "2026-09-23",
      "locators": [
        {
          "url": "local:validation-log",
          "locator": "canonical field evidence.species"
        }
      ]
    },
    "evidence.population": {
      "state": "unavailable_after_search",
      "value": null,